,0,1,2
41,Gorey descriptions of animals being slaughtered,"I did NOT expect this graphic brutality when I bought this book; circus animals killed because of lack of food or just laziness on the part of the handlers. The story starts off in an engaging way, Jake the old man in the nursing home was entertaining. But there were too many instances of animals being abused/killed that I could not finish this book as it seemed to become the main focus. Too many animals in life are mistreated as it is and I do not need this information shoved in my face via a novel. This book should come with a warning to potential readers right on the front cover.",0
42,Not Vintage MacLean,"This is the weakest book of his I have read, and that is about thirty MacLean novels.  I understand that he passed away prior to this book being  published and that is was compiled posthumously.  While admittedly not all  of his books are great, I don't feel this is up to snuff with any of the  others.  Don't make this your first MacLean book and unless you feel the  desire to read every one of his books like I choose to, take a pass on it.  I am unwilling to touch any of the Alistair MacNeill books written using  MacLeans notecards because I feel those are apt to be pretty weak too, and  no one ever seems to duplicate the originals.  If you are going to give a  couple of MacLean novels a try, go for &quot;Where Eagles Dare&quot;,  &quot;Puppet on a Chain&quot;, &quot;Bear Island&quot;, &amp; &quot;Ice  Station Zebra&quot;.",0
43,"nasty, could not finish","There should be a warning on books like this! With all the good reviews I thought it would be a good book, so I checked it out from my library. There are porn scenes in this book, so I stopped reading and returned it right away. I do not want to read stuff like that.",0
44,Repetitive and Boring but Well Researched,"I gave three descriptions in my title, that say it all, but the first two speak the loudest - this book is repetitive and boring.  The train rolls in, the train rolls out; in the old folk's facility Jacob is nothing but cranky and rude over and over again.  I truly don't understand how this book was picked up for publication.  I can more easily understand that it was made into a movie (even though I haven't seen it and after reading the book I probably won't), as I can imagine it is truly a spectacle with all of the color and magic of a circus.  And I will agree with other reviewers that it is well researched and the author does a good job portraying the post-depression times.  But that alone just doesn't carry the rest of the storyline, which is shallow and trite.  Among so many unaddressed issues - how is it that Jacob, an ivy league-educated young man, never looks back at what his life might have been after joining the low-lifes (mostly hobos, plus the entertainers) the circus attracts?  Certainly it's not to care for the animals, as you see him doing very little of that in the book.  At the end he wants to ""run away"" from the old folk's home and return to the only life he'd ever known - no surprise there - but it's a ridiculous proposition due to his age and I can't imagine anyone in the circus inviting him.  If you get nothing else from Uncle Al's character it is that he or any man in his position would be ruthless and cut loose anyone who didn't pull their weight, so what would a 90+ year old man do?  Certainly not water the elephants.",0
45,Don't waste your time,"I kept reading because I was hoping it would get better and redeem itself in the end, but it never did.  Rawness and grit do not substitute for depth.  I appreciated the accurate perspective of an elderly person.",0
46,tedious,"Life's a bitch and then you get old and it's worse and then you die.  That's all you need to know, which is a good thing because this novel has left me too depressed to write any more.",0
47,boring.....,"I couldn't finish the book I was so bored and I HATE leaving books unfinished. I didn't like the crudeness of it either, I just don't see why it was such a hit...... blah!",0
48,Just Too Boring,"I will admit, I usually would not write a review for a book if I do not finish it, however my feelings for this book are exactly why I never finished it.I first bought the book around three or four years ago and tried to read it then. I got about halfway through before it became too boring. More recently, I tried reading it again from the beginning and got less than halfway through.The main problem with Red Mars is that the author finds it necessary to put in an excruciatingly large amount of detail in everything. From describing procedures the astronauts use to descriptions of the Martian environment. A certain amount of detail is nice and helps create a vivid image, but I am not an astronaut-in-training so all the excessive technical detail should have been avoided.In my own opinion, pretty much every character in the book is annoying. I found some of them rather flat. They seem intent on talking politics (read: the author's political beliefs) or getting themselves into love triangles and wondering what went wrong. This does not help when the story shifts from one character to another when it is hard to like any of them.The book teeters on the edge of complete implausibility. I can believe the technology used to get the First Hundred to Mars, but the fun ends there. First, we are led to believe that space agencies would be so mind-blowingly incompetent as to send a bunch of under-qualified astronauts on a long-term mission to Mars. Later in the book (and I do not think I am spoiling much here), the colonists come up with a plan to use a bunch of wind-powered heaters to increase the overall temperature of Mars. Nonsense.I had hoped to read the entire trilogy as an epic story about colonizing and terraforming Mars. Instead I never made it more than halfway through the first book. If you want some real science fiction, go read some Clarke. This book did nothing for me.",0
